,title,subreddit
314,Blitzer to Stephen Miller: Why did Trump fail?,0
315,Why Donald Trump changed his mind on the border wall (HINT: It has to do with Fox News),0
316,The Border Wall GoFundMe Page Sums up the Trump Presidency,0
317,Trump officially legalizes industrial hemp,0
318,Trump supporters' anger at wall 'retreat',0
319,Trump calls last-minute meeting with House Republicans amid border wall showdown,0
320,"As Paul Ryan Says Goodbye, Progressives Say 'Good Riddance' to 'Coward Who Sold Our Economy to Highest Bidders'",0
321,US pressures China to allow unmonitored access to Tibet,0
322,Read: William Barr’s Memo Bashing Robert Mueller’s Obstruction Probe,0
323,Poll: Majority say sitting presidents should be subject to indictment,0
324,"Nearly 40,000 People Died From Guns in U.S. Last Year, Highest in 50 Years",0
325,Trump announces Mattis will leave as defense secretary at the end of February,0
326,People Are Sending Total Strangers Money to Build Trump's Border Wall,0
327,"Mattis to Retire at End of February, Trump Says",0
328,"A ‘Never Trumper’ bets on Trump, and loses",0
329,Swalwell: Trump shows 'consciousness of guilt' in Russia contact,0
330,Trump Administration Civil and Human Rights Rollbacks,0
331,Trump Ready to Remove Sanctions on Deripaska's Rusal in 30 Days,0
332,It's the One-Year Anniversary of the Day Republicans Lost the House,0
333,Trump Group Megadonor Flouts Judge’s Demand for Documents,0
334,"House approves $5 billion for Trump’s border wall, increasing chances of a partial government shutdown",0
335,"US charges Chinese hackers with 'massive theft' from NASA, Navy and tech sector",0
336,"D.C. attorney general sues Facebook over Cambridge Analytica scandal, the first major U.S. regulatory action in company’s crisis",0
337,"After Voters Passed Progressive Ballot Initiatives, GOP Legislatures Are Trying to Kill Future Ones",0
338,"Trump Lashes Out At Congress Over Border Wall, Threatening Shutdown",0
339,Emails Show Political Group No Labels Gave Work to Firms Linked to Founder’s Husband,0
340,Trump’s Syria surprise is a new attempt to distract from bad news at home,0
341,House Intelligence Committee votes on handing over Roger Stone transcript to Mueller,0
342,GOP politicians blast Trump for saying he'll withdraw troops from Syria,0
343,Investors brace for more Fed action in 2019,0
344,A Texas judge could obliterate parts of the health care system Americans actually like,0
345,Secret Experiment in Alabama Senate Race Imitated Russian Tactics,0
346,A Sweeping Bill That Will Give Non-Violent Offenders The Chance To Get Out Of Jail Early Is Heading To Trump’s Desk,0
347,"Democrats To Hold First Presidential Debate In June, Just 6 Months From Now",0
348,APNewsBreak: US miscalculated benefit of better train brakes,0
349,US charges 'China government hackers',0
350,'I am not a liar': DHS chief Nielsen defends immigration policies in heated hearing,0
351,The Real Roots of American Rage,0
352,Trump undermines his entire national security team on Syria,0
353,Acting AG Whitaker rejected advice to recuse himself from Russia probe,0
354,Wall Street swoons as government shutdown deadline looms,0
355,Trump administration aims to toughen work requirements for food stamps recipients,0
356,Trump is officially turning back all asylum seekers who come to the US through Mexico,0
357,GOP seeks to ram through Trump’s $5B wall demand,0
358,Trump Emoluments Suit Put on Hold by Richmond Appeals Court,0
359,"Pelosi draws link between Flynn, Trump decision on Syria",0
360,The Latest: Trump tells House GOP he won’t sign Senate bill,0
361,Mueller to Save Trump for Later as Prosecutor Readies Next Steps,0
362,Here Comes the 2020 Election Interference. It Will Be Worse,0
363,The Small-Town Cost of Donald Trump’s Trade Wars,0
364,Graham Encourages Trump To ‘Dig In’ And ‘Force’ Congress To Give Him Wall,0
365,Prosecutors hint at 'imminent' criminal litigation tied to Butina,0
366,William Barr’s Memo About Mueller Parrots Trump’s Own Argument He Can’t Obstruct Justice,0
367,Trump’s war on basic logic,0
368,Rudy Giuliani is defending Trump with an argumentative technique even he admits is confusing,0
369,North Carolina officials sought to charge political operator,0
370,Remember the Big Story in the Russia Scandal: Donald Trump Betrayed America,0
371,"Senate Hints it Doesn’t Oppose Sanctions Relief for Russian Linked to Putin, Manafort",0
372,"Trump vents frustration over wall funding, fueling uncertainty over shutdown",0
373,"Leaks show Trump signed off on Trump Tower Moscow project. After weeks of calling Cohen a liar, the president inadvertently proves him right.",0
374,"Germany, France, UK: 'Islamic State' not defeated in Syria",0
375,Trump Announces Defense Secretary Mattis’ Retirement,0
376,Quantum stimulus: Congress sends computing proposal to Trump,0
377,"Not Mere “Process Crimes,” False Statements Prosecutions Are Serious",0
378,Trump signs farm bill as government shutdown looks more likely,0
379,Republicans rip Trump’s surprise Syria withdrawal in meeting with Pence,0
380,Ex-Senate Intel staffer James Wolfe sentenced to two months in jail,0
381,"Wall St. Tumbles, Bothered by the Fed and Government Shutdown Fears",0
382,"No evidence FBI officials' texts deliberately erased, as Donald Trump said",0
383,Trump is sabotaging himself (and his party) by pandering to his base,0
384,Former Prosecutor: Investigation into Trump Foundation ‘Going to Become a Criminal Matter’,0
385,Kurdish-led militia slam US decision to withdraw troops from Syria,0
386,What Ever Happened to Trump’s 10% Middle-Class Tax Cut?,0
387,It started with Nazis: Concerns over foreign agents not just a Trump-era phenomenon,0
388,Trump's pick for attorney general told DOJ in memo that firing Comey isn't obstruction of justice,0
389,The Latest: US senators urge Trump to abandon Syria plan,0
390,The Laquan McDonald Shooting Keeps Exposing Critical Flaws in Illinois’ Freedom of Information Act,0
391,Airmen sue military for firing them after they tested positive for HIV,0
392,"Trump Won't Sign Senate-Approved Bill Averting Government Shutdown, Ryan Says",0
393,Dow falls more than 500 points to new low for the year after Fed hikes rates,0
394,Trump: Defense Secretary James Mattis Retiring in February,0
395,For-profit prisons strongly approve of bipartisan criminal justice reform bill,0
396,"Trump Outright Ignored Pentagon, State Department Syria Policy in a Big Win for Putin",0
397,Gov. Wolf says it’s time for Pennsylvania to ‘take a serious look’ at legalizing recreational marijuana,0
398,Kansas GOP senator Pat Roberts considering retirement in 2020,0
399,U.S. stocks extend slide; Dow down 400 points at lows after Fed’s rate hike,0
400,"Trump Rejects Senate Bill, Sends House GOP Scurrying To Avoid Shutdown",0
401,Trump announces Secretary of Defense James Mattis will retire at the end of February,0
402,"How U.S. Policies Punished Central Americans, Long Before Jakelin Caal Maquín’s Death",0
403,Trump’s surprise Syria pullout is a giant Christmas gift to our enemies,0
404,Trump isn’t playing five-dimensional chess,0
405,"Rep. Adam Schiff: If Michael Cohen Goes to Jail, Why Wouldn’t Trump?",0
406,Congress Just Took a Big Step Toward Ending the Shackling of Pregnant Prisoners,0
407,Trump's base is pushing him to the edge of a government shutdown over the border wall,0
408,"Airmen sue after military discharges them for their HIV status. ""Deploy or get out"" was apparently just a cover for this kind of discrimination.",0
409,‘Fox & Friends’ ‘Stunned’ by Trump’s Loss to Pelosi on Border Wall Funding,0
410,Trump Administration to Lift Sanctions on Russian Oligarch’s Companies,0
411,Treasury to terminate sanctions on Russian aluminum company Rusal,0
412,House Democrats’ First Bill Is a Winner. Too Bad There’s a Loser Running the Senate.,0
413,"Bipartisan senators call Trump's Syria withdrawal a ""costly mistake""",0
414,"Beto O’Rourke frequently voted for Republican legislation, analysis reveals",0
415,"Conservatives Persuade Trump to Trash Spending Deal, Making Government Shutdown More Likely",0
416,"After Trump announces Syria withdrawal, Turkey says Kurdish Militants will be buried in ditches",0
417,"Enquirer Insider: 'Shoe To Drop' on Saudi money, AMI, Trump",0
418,Rudy Giuliani: 'I don't see the magic in a wall',0
419,Stay issued in lawsuit over Trump hotel,0
420,Robert Reich: America's Economic Suffering Is Just Beginning,0
421,Paul Ryan: Trump Won't Sign Spending Bill Meant To Avert Government Shutdown,0
422,Kraninger reverses Mulvaney’s CFPB name change in first move as director,0
423,The Year in Trump Freakouts,0
424,Trump lashes out as House struggles with avoiding shutdown,0
425,Senate passes last-minute effort to hold VA accountable for GI Bill screw-ups,0
426,"The 7-Year-Old Guatemalan Who Died In US Custody Was Given No Water For Hours, Lawyers Say",0
427,"Mueller may submit report to attorney general as soon as mid-February, say sources",0
428,Trump lawyer Rudy Giuliani: 'I could build a wall for him with long-range cameras and security',0
429,Greenstein: Trump SNAP Proposal Would Cost Many of Nation’s Poorest Their Food Aid,0
430,U.S. Weighs Significant Troop Drawdown in Afghanistan: Officials,0
431,"Mueller zeroes in on Flynn sanctions call with Russian, reports",0
432,"More Kansas lawmakers switch parties: Sykes, Clayton leave GOP, become Democrats",0
433,Trump says he won't sign bill to avoid government shutdown.,0
434,Turkey threatens to ‘bury’ Kurdish forces in Syria amid U.S. withdrawal,0
435,Trump signed off on Moscow project during campaign: Giuliani,0
436,Trump: Trump is never wrong,0
437,Trump’s pullback in Syria runs strongly against the views of his political base,0
438,This Photo of the Kavanaugh Hearing Helped Defined 2018,0
439,Putin Praises Trump’s Syria Troop Exit as ‘Right Thing to Do’,0
440,How a partial government shutdown could play out: By the numbers,0
441,Trump administration moves closer to opening Alaskan Arctic to drilling,0
442,"House Republicans meet with Trump, funding bill passage uncertain",0
443,A new law aims to help the pets of domestic violence victims,0
444,Trump Administration Set to Lift Sanctions on Putin Associate's Company,0
445,Rudy Giuliani Claimed Trump Tower Moscow Wasn't a Thing. Then CNN Showed Up With Receipts,0
446,Trump always folds,0
447,Republicans prefer a liar,0
448,This Vicious Buffoon Is a Vessel for All the Worst Elements of the American Condition,0
449,Now is the time for Pelosi to embrace Medicare for all,0
450,U.S. lawmakers seek oversight over any Saudi nuclear deal,0
451,Opinion | Morning Bits: Republicans are finally upset with Trump,0
452,Trump reversal on Syria policy means big gains for Iran,0
453,What do religious voters want? Definitely not piety,0
454,Roger Stone Selling Signed Rocks to Help Pay for Legal Bills,0
455,‘The public has a right to know’: BuzzFeed prevails in Russian tech mogul’s defamation suit over Steele dossier,0
456,Paul Ryan and the GOP’s hypocrisy on the debt and deficit,0
457,The Trump-Russia Timeline,0
458,U.S. considers significant Afghanistan troop withdrawal: officials,0
459,This Is The Democrats' Plan For Their 2020 Presidential Primary Debates: Democrats won’t do an undercard debate — instead splitting the first two debates into two consecutive nights.,0
460,Document: William Barr Memo on Obstruction Investigation,0
461,Trump Today: President suggests he may not commit to shutdown fix as he vents about border wall,0
462,Region senator files proposal to legalize recreational marijuana use in Indiana,0
463,SECDEF to retire,0
464,"Giuliani flips story, says Trump signed letter",0
465,Donald Trump dumps Ann Coulter on Twitter after she rips his inability to deliver a campaign promise,0
466,Paul Ryan Only Ever Cared About the Rich,0
467,Conservatives mount full-court press to convince Trump to shut down government,0
468,Letter from Treasury Dept. To Senate Leader Indicating That Sanctions Will Be Removed From Oleg Deripaska's Companies,0
469,NY bill would require giving over passwords and 3 years of search history as part of more stringent firearm background checks.,0
470,Bipartisan carbon-tax bill introduced in the Senate offers glimpse at future,0
471,Ann Coulter predicts Trump will be the last Republican president,0
472,Defense Secretary James Mattis to retire in February,0
473,Syria's Kurds say US pullout 'harms anti-IS fight',0
474,"Mattis, once one of ‘my generals,’ loses his influence with Trump",0
475,Syrian Allies to U.S.: Withdrawal Now Will Help ISIS Recover,0
476,US Senate finally passes anti-lynching law,0
477,Federal Judge Deems Trump’s Asylum Restrictions Unlawful,0
478,Donald Trump Defends His Disgraced Foundation’s ‘Great Work’,0
479,"Giuliani Says Trump Signed Russian Trump Tower Deal Letter. 2 Days Ago, He Said Trump Didn’t",0
480,"Trump Demands Border Wall Money, Plunging Shutdown Fight Back Into Chaos",0
481,This Little-Known Libertarian Training School Is Making Federal Judges More Conservative,0
482,US and UK accuse China of sustained hacking campaign,0
483,"Trump’s immigration rhetoric has ‘chilling effect' on families, says children’s advocacy group director",0
484,DoJ Told Whitaker He Doesn’t Have to Recuse Himself From Mueller Probe,0
485,Flake to co-introduce bipartisan climate bill,0
486,A Federal Judge Just Struck Down Trump’s Harsh Restrictions on Asylum,0
487,Conservative Revolt Endangers Deal to Avoid a Shutdown,0
488,Rudy Giuliani is the fool for our time,0
489,Trump is back to demanding a government shutdown,0
490,New York’s next Attorney General targeted slumlords. Now she’s going after Trump.,0
491,US also seen ending air war against Islamic State in Syria: officials,0
492,"Scoop: Netanyahu rejected Russian plan to work with U.S. on Syria, Iran",0
493,Russia praises US decision to pull troops out of Syria,0
494,Trump Promotes Farm Bill Signing With Video Of Him Singing At Emmys,0
495,Whitaker advised he doesn't need to recuse himself from Russia probe: source,0
496,"Donald Trump signed letter of intent over Moscow Trump Tower project, leaked document reveals",0
497,Mattis to retire at end of February,0
498,Democrats to start presidential primary debates in June 2019,0
499,We were FBI agents. We want to know why Flynn lied to the bureau.,0
500,Confusion reigns on the Hill over path of short-term funding bill,0
0,House Passes Spending Bill With Border Wall Funding,1
1,"Trump Orders Major Afghan Drawdown: 7,000 Troops To Return Home In Coming Weeks",1
2,"DO IT, JUST DO IT ""House GOP push to add $5B for border wall to spending bill clears key hurdle""",1
3,"Trump did it. ""Catch and Release"" is officially over...",1
4,"General Jim Mattis will be retiring, with distinction, at the end of February, after having served my Administration as Secretary of Defense for the past two years. During Jim’s tenure, tremendous progress has been made, especially with respect to the purchase of new fighting....",1
5,MFW Congress gives you money to build a wall out of Hympecrete.,1
6,Is he the only baker in Colorado?? At this point it's just harassment...,1
7,"Soon to be Speaker Nancy Pelosi said, last week live from the Oval Office, that the Republicans didn’t have the votes for Border Security. Today the House Republicans voted and won, 217-185. Nancy does not have to apologize. All I want is GREAT BORDER SECURITY!",1
8,"Remember this guy? Still doing a great job, and doesn’t seem to get any recognition from T_D",1
9,A Republican President is pulling out of Syria and Afghanistan and the Weekly Standard is dead. RIP Neoconservatism.,1
10,"Democrats, it is time to come together and put the SAFETY of the AMERICAN PEOPLE before POLITICS. Border security must become a #1 priority!",1
11,"Fill in the blank, Trump on Cuck.",1
12,President Trump is truly a great man!,1
13,Trump Administration Is Considering Substantial Afghan Troop Drawdown,1
14,"It's been bugging me lately that I used to be in favor of gay rights (and still am), but recently the whole ""LBGTQ rights"" thing has turned into something much more aggressive and dark. Then it hit me what has changed. It went from passive ""leave me alone"", to active ""you must cater to me or else""",1
15,"So hard to believe that Lindsey Graham would be against saving soldier lives & billions of $$$. Why are we fighting for our enemy, Syria, by staying & killing ISIS for them, Russia, Iran & other locals? Time to focus on our Country & bring our youth back home where they belong!",1
16,"BREAKING NEWS: Proposed funding for wall was at 1.5 Billion, but now at $5,700,000,000! Trump is showing signs of winning YET AGAIN! Senators who went home for Christmas will be forced to come back to vote!",1
17,Trump after signing the farm bill and dropping an epic TBT tweet.,1
18,"Thank you for your service, General. You will be missed come February. 🇺🇸",1
19,BREAKING: Speaker Ryan says Trump will not sign Senate-passed bill to avoid government shutdown,1
20,Trump officially legalizes industrial hemp,1
21,Farm Bill signing in 15 minutes! #Emmys #TBT,1
22,"Tonight, President Trump ended 81 years of hemp prohibition..all he has to do is remove marijuana from being a Schedule 1 substance and 2020 is a landslide, liberal heads will explode",1
23,"We Only Need 51 Votes. Do It, Mitch!",1
24,Thank you to our GREAT Republican Members of Congress for your VOTE to fund Border Security and the Wall. The final numbers were 217-185 and many have said that the enthusiasm was greater than they have ever seen before. So proud of you all. Now on to the Senate!,1
25,Online dating in CA is hard when you want to MAGA,1
26,"Calling proud Americans ""white nationalists"" doesn't work anymore, Joshy.",1
27,Two beautiful Scandinavian girls found decapitated in Morocco... The Jihadist filmed the decapitation! I SAW the DECAPITATION & wish every Westerner could see the THREAT we face The Migration Pact was JUST signed in Morocco which deems migration for Jihadists a “HUMAN RIGHT” -Amy Mek,1
28,Congress just passed the Criminal Justice Reform Bill known as the #FirstStepAct. Congratulations! This is a great bi-partisan achievement for everybody. When both parties work together we can keep our Country safer. A wonderful thing for the U.S.A.!!,1
29,"Hemp Prohibition Began in 1937, 81 Years Ago. President Trump Ended Hemp Prohibition With His Signature Today",1
30,"President Trump Legalized Hemp and CBD Today, Why Won't The Mainstream Media Cover This?",1
31,Beauty & the Beast,1
32,"If we can crowdfund the border wall, why can't they crowdfund Planned Parenthood?",1
33,House approves spending bill with $5.7B for border wall,1
34,"When I begrudgingly signed the Omnibus Bill, I was promised the Wall and Border Security by leadership. Would be done by end of year (NOW). It didn’t happen! We foolishly fight for Border Security for other countries - but not for our beloved U.S.A. Not good!",1
35,"President Trump Participates in a Signing Ceremony for H.R. 2, the “Agriculture Improvement Act”",1
36,"WOW, WTF?!?! NYT reports that Democrats carried out Russian-style tactics in Alabama Senate Race against Moore",1
37,and they overlap,1
38,Obama admin ''LOST'' $70 billion in Afghanistan but there is no money for the wall in the US to keep the country safe and secure,1
39,One of the most correct tweets I’ve seen ever,1
40,"McCain associate shared unverified Steele dossier with Buzzfeed, court filing says",1
41,"Sacha Baron Cohen: We Stumbled Upon Possible Pedophile Ring During 'Who Is America' Taping, Notified FBI",1
42,"Rush just now: The House is going to add an amendment for $5 billion for the Wall. It has to pass first, then it goes to the Senate.",1
43,"Libertarian here. Tepidly defended Trump but this week’s news on Syria+Afghanistan was the tipping point. I can no longer say “I don’t support Trump, but...” He’s the real deal and the best president of my lifetime and it’s time to give respect where it’s due.",1
44,This garbage is trending right now,1
45,Byron York: Many members of the Senate and House seem absolutely outraged that they would be required to work on December 20 and perhaps December 21.,1
46,🚨BREAKING: Shits getting crazy folks- McCain responsible for Steele Dossier Leaks - (Pardoned by death?),1
47,FOX STANDS WITH TUCKER: Fox News' powerful statement regarding companies boycotting Tucker Carlson's show.,1
48,"BREAKING: Trump announces his nomination to fill Secretary of Defense position, JOHN MILLER!",1
49,We don’t want “border security “. WE WANT THE WALL. Stay strong President Trump. Shut down the government. We support you 100%.,1
50,POTUS is in FIREEEEE Today! 😂,1
51,"Cucks are having ""selective memory"" today. 1] Mattis was fired by Obama 2] Obama withdrew troops from Afghanistan, Trump increased them, now he wants to withdraw some 3] ISIS occupied most of Syria until Trump send more troops to Syria, now ISIS don't. Why are you retards crying now?",1
52,So Batman is getting his wall.....the senate will see about that. Waaa waaa waaa.,1
53,Reddit admins are mass manually censoring multiple threads around the site that mention Muslims raped and beheaded two European girls in Morocco. Including shadow removing and threatening quarantine subs not to show video or information about it.,1
54,⚠️Breaking News⚠️: John McCain returns from the dead to vote against Border Wall,1
55,Official Freedom Caucus Appreciation Thread. Thank you guys for heading up and successfully passing a bill that provides $5.7 billion for the WALL.,1
56,Let us not forget...,1
57,House to vote on new funding bill with $5.7 billion for border wall,1
58,MFW A Leftist Gets A Personal Dose Of The Exact Treatment They've Been Prescribing To Republicans For Years. Sorry David I'm All Out Of Fucks To Give. You Made Your Bed. Time To Sleep In It.,1
59,SUCK IT COOPER!: Voter ID becomes law in North Carolina as House overrides veto,1
60,"Acting AG Matthew Whitaker cleared to oversee Trump-Russia investigation, source says | Fox News",1
61,"TIL there’s a cemetery in the Netherlands consisting of 8,300 US veterans who died in WWII. For the past 70 years, Dutch families have come to the cemetery every Sunday to care for a grave they adopted. Hundreds of people are currently on a waiting list to become caretakers.",1
62,Who cares what he thinks anymore?,1
63,"""You can't get rich in politics unless you're a crook"" Harry Truman",1
64,Is The Federal Reserve Actually TRYING To Cause A Stock Market Crash?,1
65,A SAVAGE CENTIPEDE,1
66,A middle school in Seattle called the police after posters were found encouraging students to subscribe to PewDiePie... Yes Really.,1
67,"Hi, my name is John F. Kenney Jr., son of President Kennedy. In 1999 I was a sure pick to replace retiring NY Sen. Daniel Moynihan, when, despite 310 hours flight experience, my Piper Saratoga crashed killing everyone aboard. Thankfully, Arkansas native Hillary Clinton rose to fill the open seat!",1
68,"Stephen Miller: “Let’s defend our national security, let’s put America first, but let’s not spill America blood to fight the enemies of other countries as is the case in Syria.”",1
69,When Reddit Is So Cucked That Even The Cannabis Subreddit Complains About Hemp/CBD Legalization Because Trump Passed It.,1
70,"**********93%********** We've got the best women, don't we folks??!!",1
71,"Paul Sperry: BREAKING: Carter Page submits amicus brief in support of US v James Wolfe in sentencing hearing today disputing Wolfe's claim he caused ""no tangible harm to any victim"" by leaking sensitive intel on Page, who claims he rec'd ""death threats"" after Wolfe leaked to BuzzFeed,WaPo,NBC",1
72,Sen. Diane Feinstein (D-BEIJING),1
73,Seriously. Let’s do it.,1
74,BREAKING: AG Whitaker Will NOT Recuse Himself from Overseeing Mueller Probe,1
75,Never forget what this great man sacrificed. Thank you President Trump!!,1
76,I thank god everyday this man is our president and that I live in this country. God bless America and god bless Trump!,1
77,"Louie Gohmert spills the beans, says Rat Paul Ryan urged GOP lawmakers to campaign AGAINST Trump",1
78,"Rush Limbaugh just reported an I.M. he just got: ""You tell Rush, if there's no money in this bill for the Wall, I'm going to Veto it.""",1
79,UK: Be white: arrested for butter knives in your car. Be Muslim: attacking police with a sword is just fine. (Anarcho-Tyranny),1
80,Ron Paul: Warmongers Upset With Trump's Syria Decision,1
81,Acting AG Whittaker will NOT recuse himself from overseeing Russia probe.,1
82,"Hilary Clinton is given a free pass with multiple crimes, but trump, who has done nothing illegal, is constantly harassed in an effort to uncover dirt. I was taught as a child that in America, you start with the crime and search for the perpetrator. Sadly, that is no longer the case.",1
83,Calling all Pedes: Our sub is being brigaded hard. (Check ratios in any thread) We need pedes in the new section so that important topics make it to rising!,1
84,"“I’m proud of the President today to hear that he is declaring victory in Syria.” Senator Rand Paul. “I couldn’t agree more with the presidents decision. By definition, this is the opposite of an Obama decision. Senator Mike Lee",1
85,"DON'T LET THE SHILLS DOWNVOTE : Page 390 IG Report - FBI Agent "" So , you find Huma lied , BFD . No one at DOJ is going to prosecute .""",1
86,"Huckababe: Due to the Trump administration’s strong leadership, “catch and release” has ended. Illegal immigrants apprehended in the U.S. must now return to Mexico. Thank you to the government of Mexico, who is now doing more to solve our illegal immigration problem than the Democrats.",1
87,VP Pence Space Force Speech with Halo Theme Added 🇺🇸🚀,1
