,title,subreddit
88,"Hey cucks, remember when this man promised to end the wars in the middle east, you elected him, then he sent 33k more troops to Afghanistan, droned a bunch of civilians, and got us into a 3rd war?",1
89,"MESS WITH THE BULL YOU GET THE HORNS! Trump refuses to sign the deal unless the wall is funded. Let 'em all celebrate Christmas away from their families. No one in Congress is going to die, unlike the Americans who are killed by MS-13.",1
90,YOU MOTHERFUCKERS THINK HE WAS PLAYING?,1
91,"While everyone is digesting the Mattis news, here’s some perspective. 700 days is about the average length of time served for a secretary of defense",1
92,"Comey confirmed dossier was unverified AFTER signing FISA based on it (i.e., violates Woods procedure, confirmed)",1
93,ANTIFA LEADER RELIED ON ANONYMITY TO PUSH RADICAL COMMUNIST AGENDA ⋆ The Savage Nation,1
94,Trump heralds Farm Bill signing by tweeting video of himself singing 'Green Acres' theme song - Video and buckets of Liberal tears in article - Floodgates opened,1
95,OH SHIT!!!!!! 😂😂😂😂😂😂😂😂😂😂,1
96,"This is why it must always be no way to any sort of amnesty. Give amnesty to 12 million, they will still be screaming racism and demanding asylum for 100 million of their relatives. They are never grateful or satisfied.",1
97,MAD DOG’S RESIGNATION LETTER. WAS HE PISSED ABOUT SYRIA?,1
98,"Looks like the Podesta Bros. are out of cash. Hopefully, the current AG will enforce the laws! Tony Podesta sues former clients, seeking to collect on unpaid bills",1
99,"Getting out of Syria was no surprise. I’ve been campaigning on it for years, and six months ago, when I very publicly wanted to do it, I agreed to stay longer. Russia, Iran, Syria & others are the local enemy of ISIS. We were doing there work. Time to come home & rebuild. #MAGA",1
100,"Does the USA want to be the Policeman of the Middle East, getting NOTHING but spending precious lives and trillions of dollars protecting others who, in almost all cases, do not appreciate what we are doing? Do we want to be there forever? Time for others to finally fight.....",1
101,Trump pulls troops out of Syria...,1
102,"Shocked! Shocked, I tell you!",1
103,The MSM wants Endless Wars. Those days are over. Thank You Mr.President.,1
104,WE WANT THE WALL. WE WANT CLINTON IN JAIL. WE WANT TO MAKE AMERICA GREAT AGAIN. ITS THAT SIMPLE.,1
105,Playing with Play Doh with my two year old adorable deplorable. Behold: The Dohnald.,1
106,"""wtf we love military intervention now"" -The Media",1
107,Hi energy Senator David Perdue.,1
108,BREAKING: Democratic operatives created fake Russian bots designed to link Kremlin to Roy Moore in Alabama race,1
109,"Rush Radio: Donald Trump 'Got Word to Me' About Shutdown Fight Plan | “The president got word to me 20 minutes ago that if it comes back to him without money, if whatever happens in the House and Senate comes back to him with no allocation of $5 billion for the wall than he’s going to veto it,”",1
110,Why didn’t I think of this before?,1
111,BOOM! DHS Tells Congress: You Are Too Slow On Immigration Problems We Will Now Start Deporting All Illegal Aliens Immediately And Make Them Wait In Their Own Countries Until Their Asylum Claims Get Ruled On,1
112,"Trump threatens to veto infrastructure, other Democratic bills without wall funding.",1
113,PEDES THE PRESSURE IS WORKING! Trump just called Ryan in the middle of the conference! Trump might not sign this NO WALL CR! SHUT IT DOWN,1
114,Stole this from a fellow pede. Now that we’ve got $5.7B on the table. I want to see this BBW from coast to coast!!!,1
115,CONFIRMED BY SARAH! NO WALL NO DEAL!,1
116,"Switching Tactics. Instead of trying to hide Soros’ meddling in US alt left politics, the fake news is now trying to cover his evil schemes by making him Person of the Year. Sick and disgusting.",1
117,Colonel Allen West for Sectetary of Defense! Let's make this happen! Meme into reality!,1
118,"It's extremism to want a wall, but reasonable centrism to demand a permanent military presence in a sovereign nation without congressional approval! Can somebody explain this?",1
119,"Pelosi: You don’t have the votes in the House for the wall. Trump: Nancy, I have the votes if I want them!",1
120,"Today they brigade, but we all know that Hillary Clinton will never, EVER be President of the United States, forever and ever 🇺🇲",1
121,"Secretary Sanders: Due to the Trump administration’s strong leadership, “catch and release” has ended. Illegal immigrants apprehended in the U.S. must now return to Mexico. Thank you to the government of Mexico, who is now doing more to solve our illegal immigration problem than the Democrats.",1
122,Donald J. Trump on Twitter - Thank you to our GREAT Republican Members of Congress for your VOTE to fund Border Security and the Wall.....,1
123,"Fat rail, turtle engaged!",1
124,"“The Trump temper tantrum will shut down the government, but it will not get him his wall,” said Senate Minority Leader Chuck Schumer. We'll see Chuckie Baby. We'll see.",1
125,Doug Jones calls for investigation of democrat tactics in Alabama senate race,1
126,"Not many people can replace Mattis, but I have just the guy. Say it with me: Mike Flynn for Secretary of Defense.",1
127,“I will teach them”,1
128,In FY 2016 (Obama) the nonpartisan Congressional Budget Office estimated $310 billion was spent without Congress Authorization: Chaffetz Serving Red Pills for the Wall!,1
129,"THIS is why you NEED to own guns and Open/Conceal Carry! “A Florida Judge Ruled that Police Officers Had No Duty to Protect Students in Parkland Massacre.” Hmm, then WHY even have Government Police Officers if they’re NOT going to protect us??",1
130,"CNN's Journalist of the Year (2014) admits to fabricating stories “on a grand scale”, was both an editor and a Journalist! FAKE NEWS is real!",1
131,Christopher Steele ADMITTED IN COURT that he wrote the Dirty Dossier to help Hillary Clinton steal the election that she lost,1
132,They didn't like this one 😂,1
133,"I just had an insanely brilliant idea: Let’s ask Alex Jones and friends host a 24-hour live-stream telethon for wall funds!!! Alex, please, if you are seeing this!!!!!!",1
134,WINNING: House GOP will add $5b in funding for border security + money for disaster relief to current CR. When Trump was told there is likely not enough votes for that to pass he said: “that’s a negative attitude.”,1
135,Crooked Hillary encourages butthurt in 9 year old girl who lost class president to a boy,1
136,"Victor Davis Hanson: ""The wall would make illegal crossings almost impossible, saving lives. The reason a secure border wall has not been — and may not be — built is not apprehension that it would not work, but rather real fear that it would work only too well.""",1
137,The Washington Compost and their Propaganda,1
138,Triggered,1
139,"Babylon Bee: Disappointed Soldier Was Looking Forward To Hanging Out In Syria For Another 20, 30 Years",1
140,The Girl With The MAGA Tattoo,1
141,"Dear brigaders, you'll never be able to meme correctly.",1
142,Trump Approval More Stable Than Approval for Prior Presidents,1
143,"John Kasich Vetoes Protections for Ohio Gun Owners on Wednesday (Kasich needs to be brought up on Tyranny & Treason charges, end of story)",1
144,At this point it's harassment,1
145,"Love , NOT love.",1
146,"And Just Like That, Minutes After Speaker Ryan Announced Trump Would NOT Sign CR, the House Finds $5 Billion to Fund the Border Wall!",1
147,"Soon to be Speaker Nancy Pelosi said, last week live from the Oval Office, that the Republicans didn’t have the votes for Border Security. Today the House Republicans voted and won, 217-185. Nancy does not have to apologize. All I want is GREAT BORDER SECURITY!",1
148,You just can't please deranged Democrats.,1
149,"Donated 50$. It might not be much, but my voice will not be silenced. I will fight til my very last breath god willing. MAKE AMERICA GREAT AGAIN!",1
150,"Washington ""Shaken, saddened, scared"" How you know the right thing was done",1
151,Climbing faster than an illegal Immigrants at the border!,1
152,I heard you might be in need of a tough hombre to lead the Department of Defense...,1
153,"""I wonder what NBC would do if they knew that my brother and I often got real guns for Christmas""",1
154,Redacted HATES it when you point out that Obama sent cash to a state sponsor of terrorism.,1
155,Just saw big MAGA sign on side of highway! MAGA!,1
156,I have noticed that the only time you see President Trump genuinely smile is when he’s around his grandkids.,1
157,Build the wall! Get em out!,1
158,"Nancy Pelosi ""the Fact is you just don't have the votes to pass borderwall funding in the house"" checks news House just passed it.",1
159,We’ve hit $8.5 million everyone!,1
160,Our President. Support his fight. Thank you.,1
161,Is The Federal Reserve Actually TRYING To Cause A Stock Market Crash?,1
162,Two thumbs up for GOA,1
163,The Enemy Of The People,1
164,When Trump first took office Democrats complained that he'd start wars. NOW they complain that he’s ending them.,1
165,Thank you Mr. President for keeping your promises.,1
166,"Getting out of Syria was no surprise. I’ve been campaigning on it for years, and six months ago, when I very publicly wanted to do it, I agreed to stay longer. Russia, Iran, Syria & others are the local enemy of ISIS. We were doing there work. Time to come home & rebuild. #MAGA",1
167,VERY FAKE NEWS CNN GETS BTFO,1
168,"So hard to believe that Lindsey Graham would be against saving soldier lives & billions of $$$. Why are we fighting for our enemy, Syria, by staying & killing ISIS for them, Russia, Iran & other locals? Time to focus on our Country & bring our youth back home where they belong!",1
169,"Suck it up, Buttercups.....",1
170,Merry Christmas Pedes,1
171,Why Syria and the wall funding was a 4d chess move,1
172,All I want for Christmas is a BIG beautiful wall. 50 feet high!,1
173,I respect people that although aren't fans of GEOTUS they are willing to be honest and speak the truth,1
174,They can't even fathom that someone in Washington is actually trying to do what they said they would,1
175,So I decided to check out the French President's Twitter.... aaaaand he's tweeting in Arabic. 🤣 🤣 🤣,1
176,Concern Shills BTFO. He’s fighting back!!!,1
177,Walls Are IMMORAL & RACIST!,1
178,Those damn politicians who actually listen to their base,1
179,FITTON TO TUCKER CARLSON: We need a special counsel for the special counsel!,1
180,Did somebody say there's a Secretary of Defense spot open???,1
181,RINOS and Leftists very mad Trump kept promise to pull out of Syria :),1
182,FBI must have been busy 'doing other things' to not investigate this Las Vegas pedophile ring,1
183,"McCain associate shared unverified Steele dossier with Buzzfeed, court filing says.",1
184,"Believe it or not, there was a time when SNL wasn't super cucked. Now, enjoy 25 minutes of Norm McDonald making fun of the Clintons about lying, draft dodging, donations from China and VINCE FUCKING FOSTER!",1
185,Almost to $9 million! Keep sharing it with friends and family!,1
186,Stephen Miller Quizzes Wolf Blitzer: How Do Dems Support Border Security?,1
187,Trump Slams Syria Pullout Critics: “I’ve Been Campaigning On It For Years”,1
188,Allen West For Secretary of Defense 🇺🇲,1
189,Utmost respect to this high-energy REAL American hero! You're doing amazing things Brian!,1
190,That should buy a few bricks,1
191,Howard Dean coming off as awfully Islamophobic here,1
192,TMW you realize Trump supporters are now the anti-war hippies and the left are the war mongers. Make memes not war!,1
193,"I’ve seen some humorous suggestions, but in all seriousness: what about ret. Admiral Mike Rogers for Sec Def?",1
194,"Lol, Brennan is about to have an aneurysm because we have Trump is another JFK, committed to peace and against the secret government",1
195,"Some in media seem almost apocalyptic down here over Rush Limbaugh advising Trump on the border wall and shutdown strategy. In a related story, Al Sharpton, an MSNBC host, visited the Obama White House 82 times during his presidency, according to WH visitor logs #SelectiveOutrage",1
196,Transgender woman creates counter-campaign for border wall ladders. Mental illness is a terrible thing.,1
197,HA! :),1
198,Alan Dershowitz Calls Out Tucker Carlson on Immigration Comments to His Face (Tucker Handles It Like A Boss),1
199,"In 2017...""Wikileaks released new evidence of US President-elect Donald Trump’s assertion that Barack Obama was the founder of ISIS – a leaked audio of US Secretary of State John Kerry’s meeting with members of the Syrian opposition at the Dutch Mission of the UN....""",1
200,"Muslims in Europe Becoming Less Secular, More Radical",1
201,Im old enough to understand fake outrage,1
202,Does anyone else think Shepard Smith is an annoying prick?,1
203,Family of Utah mayor killed in Afghanistan gets mortgage paid off,1
204,MCCONNEL AND RYAN ARE MOTHERFUCKING RINOS. PERIOD. SHUT IT DOWN. FUCK THEM,1
205,"FYI - Democrats & Rhinos stopped Trump from helping allies in Yemen and voted to stop US involvement in Yemen....now they are talking about helping ""allies"" in Syria....Evil douche bags!",1
206,"Trump suckered all of D.C. into thinking ""well he's going to find some other way to fund it, he won't veto"" and half of them went home for Christmas. Some of them don't have a place to live in D.C. anymore because they're leaving office. LOL.",1
207,Did my part!,1
208,"Congratulations, leftists brigaders! You have converted me. I was going to vote for Trump in 2020, but those downvotes really made me reconsider. Very effective strategy.",1
209,Don Jr. must be so proud to know that his father will go down as the greatest president in history!,1
210,All I want for Christmas is a big beautiful boarder wall.,1
211,"According to islamophile BBC: BEHEADING female tourists = ""nEcK iNjUry""",1
212,Where were you when the drum circles went silent?,1
213,"ILLEGALS STEAL $5 BILLION EVERY 16 DAYS. The net cost of illegal immigration is $116 billion per year (illegals pay $19 billion in taxes and take $135 billion, source: FAIRUS.ORG). The $5 billion needed for the wall is stolen by economic parasites EVERY 16 DAYS.",1
214,Change My Mind!,1
215,this fucking SOYBOY made me sick,1
216,Alex Jones says Subscribe to Pewdiepie!,1
217,"Tha Military-Industrial Complex has an incredible hold on the Washington Swamp. Trump orders troops out of Syria and Afghanistan, and half of Republicans, all the Democrats, and all of the FAKEStream media go bonkers. That's how you KNOW it's the correct choice.",1
218,Someone Get This Girl A Spot On CNN. Red Pills Dropping Like Crazy This Time Of Year. For The White Male Lurkers. I Don't Know How Many Times We Have To Say It. There Is No Place For You In The Democratic Party.,1
219,LIDDLE BOB CORKER says he won't come back to vote! These lazy Senators think they can enjoy Christmas ar home while the American people suffer without a wal,1
220,DOWNVOTE BRIGADE IS OUT IN FORCE! QUICK POST STUFF THAT MAKES THEM S E E T H,1
221,KISS' Ace Frehley rejoins Gene Simmons...on the Trump Train,1
222,I thought the Babylon Bee was satire?,1
223,"Am I doing this right, ‘pedes?",1
224,"Mr. President, Sorry to hear about the resignation of SECDEF Mattis, but here's your next SECDEF Nominee: John Kelly!",1
225,"INSIDER TRADING? Nancy Pelosi Net Worth is $100 Million - Pelosi Bio/Wiki 2018. Pelosi's drastic increase, from initial $21.7 million in 2009, is attributed to stock gains and smart investments. Pelosi's husband reported raking in $1 million to $5 million in 2010 from a sale of Apple stocks. AUDIT!",1
226,Scalise: $5 billion for border wall will be added to CR,1
227,"THROWBACK THURSDAY: President Trump on March 24, 2018: “I will never sign a bill like this again.” When will cucks like Paul Ryan and Cryin’ Chuck Schumer learn that the president says what he means and means what he says?",1
228,Oh nooooo,1
229,"Suck It, Nancy",1
230,If anyone needs reassurance that your money will go directly to the wall.,1
231,We are so lucky as a country to has this man as our president. God bless America and Merry Christmas pedes!,1
232,Just crossed 10 million,1
233,"“I am going to lose two World Champion titles. Just because I decided not to go to Saudi Arabia. Not to play by someone's rules, not to wear ‘abaya’ and altogether not to feel myself a secondary creature"" Anna Muzychuk",1
234,Truth.,1
235,The greatest President ever!,1
236,Kasich rejects GOP gun bill even without 'stand your ground' language (Ohio House / Senate Must Override Idiot Kasich's Veto & add back in Stand Your Ground),1
237,"""Wait, now I HATE not having U.S. troops in Syria""",1
238,Hallelujah.,1
239,Limbaugh: Trump gave word he'll veto any bill without border wall money,1
240,They're Always So Consistent,1
241,Enemy of the people,1
242,"Thank You For Your Service, Chaos",1
243,WORDS OF 4D CHESS MASTER GEOTUS: “Watch what happens.”,1
244,FUND THE WALL,1
245,Shout out to the House Freedom Caucus who has our President's back and will defend American 1st,1
246,"""Wait, now I HATE Hemp""",1
247,Is that a threat? Bitch?,1
248,Well...that happened,1
249,House approves spending bill with $5.7B for border wall,1
250,10 million freedom dollars raised,1
251,Sounds like fascists...,1
252,Cannot. Believe. This. Shite. Senator’s doxxing I.T. Aide “downloaded more information” that they thought; so sensitive couldn’t be discussed in court. Hired by Sen Hassan despite a @&%#*! FELONY. THEN hired by Sheila Jackson Lee! WAKE UP! THEYRE SELLING THESE MATERIALS!!!,1
253,Trump officially legalizes HEMP (and CBD) .... only a matter of time,1
254,Losing control of the House doesn't matter if you shut down the government,1
255,Border Patrol agents in the El Centro Sector tracked two ultralight aircraft used by Mexican cartels to smuggle more than $1.4 million in meth and two Chinese illegal immigrants into the U.S. The agents spotted the aircraft on two consecutive days - What were the Chinese going to do?,1
256,"Press Sec Sarah Sanders: Due to the Trump administration’s strong leadership, “catch and release” has ended. Illegal immigrants apprehended in the U.S. must now return to Mexico. Thank you to the government of Mexico, who is now doing more to solve our illegal immigration problem than the Democrats.",1
257,BREAKING: Paul Ryan says President Trump informed him that will not sign short-term continuing resolution passed by Senate.,1
258,"President Trump: ""We Need the Wall""",1
259,"Soros Drops $1.35 Million On ""Nonpartisan"" Watchdog Group Hitting Trump With Lawsuits",1
260,"President Trump, Veto this Spending Bill, Fight for the Wall",1
261,Don’t forget that a cartel beheaded a Latino teen in Alabama. The victims of illegal immigration are minorities as well as “privileged white people”,1
262,"The Nation of Islam has hundreds of thousands of dollars from the U.S. government since 2008 to teach religious study programs for federal prison inmates. They preach that white people are “blue-eyed devils” and Jews are “the synagogue of Satan."" But let Trump say he doesn't like bagels...",1
263,But ... but ...but ... it's DEMOCRATIC Socialism!,1
264,"Texas Bill Would Keep DACA Recipients from Receiving In-State Tuition - Just as a foreign student on an F visa or a student from Oklahoma, DACA recipients would pay out-of-state tuition if they attend Texas public universities",1
265,Democratic operatives created fake Russian bots designed to link Kremlin to Roy Moore in Alabama race,1
266,"Because of President Trump, my cousin will be coming home from Syria for Christmas! Now bring the other one home from Afghanistan! Fully onboard the MAGA train now! #TrumpTrain",1
267,"President Trump Secures House Votes For Funding the Border Wall, Same Day He Legalizes Hemp...Will The Wall Be Made of Hempcrete?!?",1
268,It do be like that tho,1
269,"California cops are 'frustrated' with sanctuary laws stopping them from working with ICE - Tulare County Sheriff Boudreaux said law prevented him honoring ICE detainer on Gustavo Garcia - ICE said Garcia's rampage was preventable, pointing blame at sanctuary laws - Sheriff agreed with ICE",1
270,#GoFundTheWall is the number 1 trend in America.,1
271,Surprise. Surprise. 1st world countries can’t meet the ridiculous Paris Climate Accord standards.,1
272,10 Stages Of Being Red-Pilled,1
273,Amy Schumer should host The Oscars...,1
274,Trump Is The Commander-In-Chief. I Trust What He Is Doing.,1
275,"@realDonaldTrump When I begrudgingly signed the Omnibus Bill, I was promised the Wall and Border Security by leadership. Would be done by end of year (NOW). It didn’t happen! We foolishly fight for Border Security for other countries - but not for our beloved U.S.A. Not good!",1
276,"125,000 years ago, due to global warming, a giant ice sheet sheared off and flooded the world. I had no idea man was burning coal and driving cars back then!",1
277,"George Papadopoulos: When my Capitol Hill testimony is made public, it’s going to rock this country! So much to be revealed. Timing is everything.",1
278,Rare picture of Abraham Lincoln discovered!,1
279,House approves spending bill with $5.7B for border wall !!!,1
280,NC Voter ID Bill Becomes Law After Lawmakers Override Governor's Veto,1
281,This post aged well,1
282,"Does it come in red, white, and blue?",1
283,"Aw, thank you Snopes!",1
284,"Family's Christmas Stamps Rejected Because of ""Religious"" Content",1
285,And Nancy Pelosi said the Republicans didn't have the votes 217-185! Take that bitch!,1
286,Just call him Wall-E,1
287,the new normal,1
288,I saw this one in my feed and thought I'd share,1
289,"CNN, elections have consequences. You and your warmongers lost. You don't get your war with Russia. It is not the role of the US to police the entire world. You lose, peace and prosperity wins. Go fuck yourselves.",1
290,"Outgoing Democratic Senator Blasts Pro-Choice Activists: ‘Irritating,’ ‘Dumb’",1
291,ISIS fanatics take to social media to share video of Scandinavian tourist's beheading,1
292,"Saudi Arabia, UAE send troops to support Kurds in Syria==This is so important. And it counters all the Marco, Lindsay comments. Anyway, with Erdogan publicly slamming the Saudi’s with the killing has only pissed em off. Now they will be more serious than ever to oppose Turkey out of spite if no oth",1
293,THESE 2 IDIOTS DAMN SURE DONT SPEAK FOR ME. HERE IT IS... TRUMPS NOT PLAYIN. 5 BILLION OR ITS DOWN. LOOK AT THESE FOOLS SPIN THEIR AGENDA. THEY DONT WANT ANOTHER WIN FOR TRUMP.. PLAIN AND SIMPLE.,1
294,Trump Rounds Up Allies To Aggressively Push China On Stealing US Technology,1
295,Dem Christmas Spending Bill,1
296,"""Mr. President, we don't have the votes in the House for a wall""",1
297,Holy shit almost to 4.5 million on 3 days #BuildTheWall,1
298,If congress care so much about military intervention in Syria why didn't they ever get around to actually authorizing it?,1
299,A transsexual and a horse walk into a bar......,1
300,The world’s greatest builder.,1
301,Lol,1
302,Islamist Screaming “Allahu Akbar!” as He Attacked Cops with SWORD Found Not Guilty – Did Not Mean to Hurt Anyone,1
303,The Face I Make when Lefty Shills are Spending all their free time being downvotin' hozers!,1
304,"Happy Trails, Paul Ryan!",1
305,Got to meet Nigel Farage today! 💪🏼,1
306,"Build that wall BREAKING: The House has approved $5.7 billion for President Trump's proposed border wall, the bill now goes to the Senate.",1
307,MERRY CHRISTMAS.,1
308,House approves spending bill with wall money. Fuck Paul Ryan for taking so long.,1
309,"Did I say that out loud? ""Just a few more years of unlimited illegal immigration and I will rule forever.""",1
310,"Thousands of Construction Worker Pepes stand at the ready, just in case the Senate grows a pair...",1
311,"California Taxes, Overregulation Forced 1,800 Businesses To Relocate in 2016 alone. Top reason to leave no longer high taxes; legal climate toxic, e.g. new CA Immigrant Worker Protection Act fines companies for following federal immigration law.",1
312,PAST 10 MIL,1
313,Mattis: Obama had 4 Secretaries of Defense over 8 years.,1
314,"Rush: Do the Right Thing and Be a Hero, Mr. President",1
315,The Madman calling out Nancy like the loser she is! No apology necessary = BTFO,1
316,The MADMAN!,1
317,"Another successful lefty boycott! ""Chick-Fil-A to Become Third-Largest Fast Food Chain in U.S.""",1
318,"The average tenure for a Sec. of Defense is 2 years, which is the time Mattis served",1
319,If you build it...,1
320,Trump directs USDA to expand work requirements on food stamps,1
321,"Soon to be Speaker Nancy Pelosi said, last week live from the Oval Office, that the Republicans didn’t have the votes for Border Security. Today the House Republicans voted and won, 217-185. Nancy does not have to apologize. All I want is GREAT BORDER SECURITY!",1
322,Lefties can’t handle the truth. Abortion is murder and no amount of downvotes can change that!,1
323,And we’re donating to kickstart it.,1
324,"To override the Veto, Ryan would need 2/3rds of the House. Trump is making Ryan override the Veto, further revealing him to be the cuck he is as the door hits him in the ass on the way out.",1
325,Federal Government shutdown and a wall! Sounds like a win-win to me.,1
326,BOOM! $5.7 Billion Dollar Border Wall Was Just Approved By Congress,1
327,Trump 100% Vindicated. CNN Journalist of the Year FIRED for fabricating fake news stories. CNN reports irrelevant fiction.,1
328,Women Who Love Trump - As a Ladypede here I can say I love Trump!,1
329,Four Sex Offenders Arrested Re-Entering U.S. in As Many Days - Agents also stopped an MS-13 member - And a lot of regular illegals,1
