,title,subreddit
0,[Megathread] Defense Secretary Jim Mattis to Step Down in February,0
1,Treasury Official Who Allegedly Leaked Trump Associates’ Bank Records Claims She Went to Congress First,0
2,GOP candidate who drove 'deportation bus' indicted on insurance fraud charges,0
3,"James Mattis will retire as secretary of Defense in February, Trump says",0
4,Schumer: House-passed border wall bill dead in the Senate,0
5,Toobin: Trump Is Shutting Down Gov’t Because Ann Coulter Got Mad At Him,0
6,"Trump proposes cutting food stamps for over 700,000 people just before Christmas",0
7,"Trump is leaving 50,000 Syrian civilians to die",0
8,ICE Seizes Over 1 Million Websites With No Due Process; Apparently Unaware That Copyright & Trademark Are Different,0
9,"'This is different:'; Mattis out, shutdown looms, stocks fall, DOJ turmoil",0
10,"As Trump Throws Tantrum for Wall Funding, His Christmas Gift to 800,000 Federal Employees: No Paychecks",0
11,115 Percent of Trump’s China Tariff Revenue Goes to Paying Off Angry Farmers,0
12,Donald Trump might be the dimmest President the US has ever had,0
13,"Whitaker will not recuse himself from Russia probe, despite ethics advice that he should",0
14,"‘A tailspin’: Under siege, Trump propels the government and markets into crisis",0
15,Dow dives more than 650 points after White House ups the chance of government shutdown,0
16,Russian Agents Sought Secret US Treasury Records On Clinton Backers During 2016 Campaign,0
17,"Trump tells GOP he won't sign stopgap, threatening shutdown",0
18,Republican senators in disbelief over Trump shutdown move,0
19,"“The Broad Outline of What Steele Was Writing Is Unquestionably True”: BuzzFeed Wins Its Dossier Suit, and Ben Smith Takes a Victory Lap",0
20,"If Trump’s actions aren’t impeachable, then what is?",0
21,No More Excuses,0
22,House Intel Votes To Give Robert Mueller Official Transcript Of Roger Stone Testimony,0
23,Pelosi says she was 'busy doing other things' during Ryan farewell speech,0
24,Poll: Americans support Mueller expanding probe beyond Russia allegations,0
25,Putin says U.S. presence in Japan complicates signing of peace treaty,0
26,Trump administration reveals plans to open protected Arctic land to oil and gas development,0
27,Trump First Called for Leaving Syria While He Was Pursuing a Moscow Tower,0
28,Trump’s Middle Class Tax Cut Is Not Happening. Merry Christmas.,0
29,Most Americans think Mueller's investigation is unbiased: poll,0
30,"People Suing Trump Over Get-Rich-Quick Schemes May Stay Anonymous, Judge Rules",0
31,A recession is coming. Trump is going to make the recovery worse.,0
32,"Rod Rosenstein, Chris Wray announce indictment of Chinese hackers",0
33,GoFundMe campaign to buy 'ladders’ created to counter one for Trump’s border wall,0
34,NAACP Launches Boycott of Facebook: Platform Is Unhealthy for African Americans & U.S. Democracy,0
35,DNC announces it will hold 12 debates for the 2020 presidential race,0
36,Trump’s presidency is falling apart and the big crybaby is cracking,0
37,Doug Jones calls for investigation into disinformation campaign during his Senate run,0
38,DHS Secretary Nielsen struggles to answer basic questions during hearing. The DHS boss couldn’t even say how many people have died in her department’s custody.,0
39,Don Lemon shows 1999 clip of Trump saying ‘nobody knows more about campaign finance’ than him,0
40,The man who taught Donald Trump how to tweet said the day the president could use Twitter on his own was comparable to velociraptors learning to open doors in 'Jurassic Park',0
41,Acting AG Matthew Whitaker Was Advised to Recuse Himself from Mueller Probe. He Didn’t Do That.,0
42,"Donald Trump Can Be Indicted While President, Says Bill Clinton Special Prosecutor Ken Starr",0
43,Kushners buying 4th New Jersey property in tax-break zone,0
44,Trump walks back claim that ISIS is 'defeated' in less than a day,0
45,Shocker: Grift King Wilbur Ross Did Not Tell the Truth About Selling His Stocks,0
46,Fmr. CIA Dir Brennan: We are left with Trump’s ‘Yes Men’,0
47,Sen. Corker says Trump canceled meeting while he was waiting at White House,0
48,Schumer tells Trump to drop attorney general pick over Mueller criticism,0
49,Now We Know Trump Picked William Barr to Shut Down Mueller’s Investigation,0
50,Did Fox and Friends Force Trump to Shut Down the Government If He Doesn’t Get His Border Wall?,0
51,Senate Democratic leader Schumer: House funding bill will not pass Senate,0
52,'Fox & Friends' Co-Host Calls Out Trump on Syria: 'Nobody Thinks ISIS Is Defeated',0
53,Republicans Skip Town as Trump Self-Immolates Over Shutdown,0
54,Paul Ryan's Career Ends as It Was: As Full of Sh*t as a Christmas Goose,0
55,US will close base in Syria that Russia complained about,0
56,"So long Paul Ryan, you won’t be missed",0
57,Rep. Meadows tells federal employees who won’t get paid during shutdown: You signed up for this,0
58,Trump tries to blame Democrats for shutdown he is orchestrating,0
59,Hemp and CBD are now officially legalized with President Trump’s signature on the Farm Bill,0
60,Trump goal of undercutting Mueller exposed in A.G. picks,0
61,Kill the Electoral College Before Another Evil Leader is 'Elected',0
62,Putin welcomes the US decision to withdraw its military from Syria,0
63,Why Russia sees the NRA as key to manipulating American politics,0
64,"Wilbur Ross held bank shares despite reporting he'd sold them, report says",0
65,Ranked choice might be the best way to get to an eventual nominee,0
66,President Trump is a terrible political dealmaker. This week proved it.,0
67,Former Senate Intelligence Committee Staffer James Wolfe Will Serve Two Months In Prison For Lying To The FBI,0
68,George Conway Thinks Trump Admin’s Relationship With GOP Is About To Collapse,0
69,North Carolina NAACP sues to stop Republican-backed voter ID law,0
70,The US will lift sanctions against companies owned by a Russian oligarch tied to the Mueller probe,0
71,"House hands over Roger Stone's interview transcripts to Mueller, indicating special counsel is ready to indict him",0
72,"Senator says Donald Trump’s “war on children” needs to end, introduces bill to close “child prison camp” at border",0
73,"Stocks Tumble Below 23,000; Twitter, Netflix, Amazon Hit Hard",0
74,"Another brutal day on Wall Street leaves Dow down 10 percent for December, headed for its worst month in nearly a decade",0
75,Rod Rosenstein Throws Serious Shade at Trump AG Pick Over Mueller Memo,0
76,Judge rules plaintiffs suing Trump over sham businesses can remain anonymous,0
77,Trump Admin Charges Ahead With 'Reckless' Plan to Turn Over Arctic Wildlife Refuge to Fossil Fuel Industry,0
78,Trump AG Pick Sent Unsolicited Memo To DOJ In June Criticizing Russia Probe,0
79,"ISIS is not defeated and will return if the U.S. pulls out, says America’s Syrian allies",0
80,"Speaker Ryan says Trump 'will not sign' bill to keep government open, citing dispute over border wall funding",0
81,Putin Nixes Trump’s Claim That Russia Is Upset By U.S. Withdrawal From Syria,0
82,I’m starting to think Mexico isn’t going to pay for the wall,0
83,William Barr’s memo on the Mueller probe is baseless and dangerous,0
84,Trump shutdown moves leaves GOP senators in disbelief,0
85,Why Fox News Made Trump Shut Down the Government,0
86,Wall Street Journal Quietly Edits Away Allegation That Bill Barr Colluded to Undermine Mueller,0
87,Acting Attorney General Matthew Whitaker Will Not Recuse Himself From The Mueller Investigation,0
88,Trump Quietly Starts Firing Servicemembers Living with HIV Just Before the Holidays,0
89,"Gladys West, the 'hidden figure' of GPS, inducted into Air Force hall of fame",0
90,Mueller requests transcript of Roger Stone's interview with House Intel Committee,0
91,North Korea says US must 'completely eliminate' its nuclear arsenal first as peace talks reach new low,0
92,Acting Attorney General Whitaker Won’t Recuse Himself From Russia Inquiry,0
93,A Complete Guide to All 17 (Known) Trump and Russia Investigations,0
94,"Trump may force government shutdown, veto bill over border wall",0
95,GOP lawmaker doubts government workers live paycheck to paycheck,0
96,"The Daily 202: Trump hands the Russians more victories with Syria withdrawal, sanctions relief and Ukraine inaction",0
97,Trump briefed Netanyahu in advance on Syria pullout,0
98,Can We Just Have Medicare for All Already?,0
99,Team of sycophants: a presidential historian on Trump’s White House | “He’s emotionally unsuited to deal with the presidency.”,0
100,Trump’s decision to withdraw from Syria marks a win for Putin,0
101,House Intel votes to release Roger Stone transcript to Mueller,0
102,Trump’s island of support is shrinking. He will grow increasingly lawless.,0
103,'This is chaos': Critics and allies alike denounce Trump's call to pull troops from Syria,0
104,Trump reportedly personally promised Rush Limbaugh he'd shut down the government over border wall funding,0
105,Rush Limbaugh: Trump Told Me He’s Getting Border-Wall Money or He’s Shutting Down the Government,0
106,Lindsey Graham: Saying ISIS is defeated in Syria is ‘fake news’,0
107,'Mass Starvation Plan': Trump USDA to Push Work Requirements for Food Stamps That Congress Left Off Farm Bill,0
108,The Point: Donald Trump just took his ball and went home,0
109,"Trump administration defies court order by pushing abstinence, Democrats say",0
110,Document: Justice Department Letter to Congress on Whitaker Recusal,0
111,"As stocks drop, Trump fears he’s losing his best argument for re-election",0
112,"""Paul Ryan is the biggest fake I've ever seen in politics,"" MSNBC panel blasts outgoing house speaker",0
113,Pressure Mounts on Hold-Out Democrats With One Day Left to Support Net Neutrality,0
114,Democrat senator: Trump plunging country into chaos,0
115,Trump likely to announce pulling Troops from Afghanistan,0
116,"Clad in a Santa cap and carrying a bag full of presents, Obama visits DC children's hospital",0
117,Retiring Lawmakers Literally Laugh Their Way Out the Door: ‘Y’all Have Fun!’,0
118,General James Mattis Retiring in February,0
119,"In budget brinkmanship, Republicans once again hold themselves hostage",0
120,Mystery Mueller Opponent Revealed to Be Foreign Company Fires Back After Significant Defeat,0
121,Senator Bob Corker Agog Over Trump Shutdown: ‘You Can’t Make This Stuff Up’,0
122,New LA County Sheriff Promises to 'Physically Remove ICE' From Jails,0
123,Watch Schumer tell Trump it’s his 'tantrum' and his 'shutdown',0
124,‘Fox & Friends’ host rips Trump over border ‘chaos’ and ‘irresponsible’ Syria withdrawal,0
125,Threat of government shutdown could force President to stay in Washington Friday,0
126,'Pressure Reaching Boiling Point' as Congress Has Just 24 Hours to Save Net Neutrality,0
127,"Sen. Graham: Trump's claim of ISIS defeat is 'fake news,' pulling troops is 'stain' on US",0
128,"Dow sinks below 23,000; Nasdaq flirts with a bear market; Oil in free fall",0
129,"Stephen Miller returns to television, minus the bizarre fake hair he was mocked for wearing on ‘Face the Nation’",0
130,Shutdown fight isn’t Trump vs. Democrats. It’s Trump vs. GOP.,0
131,‘A Moral Disaster’: AP Reveals Scope of Migrant Kids Program,0
132,"U.S. to Withdraw About 7,000 Troops From Afghanistan, Officials Say",0
133,Schumer: 'Temper tantrum' won't give GOP border wall,0
134,The Facebook scandal isn’t really about social media. It’s about capitalism.,0
135,Did Donald Trump break his pledge to forgo making new foreign business deals while in office? It certainly looks like it.,0
136,"Anti-Obamacare lawyer tries to defend his court victory, winds up undercutting his own case | These are not smart people.",0
137,Ex-Trump social media director: I said 'oh no' when Trump figured out how to tweet,0
138,The Last Grown-Up Is Gone,0
139,"Lawmaker calls Trump official 'liar,' storms out",0
140,House passes spending bill with border wall money — setting up shutdown stalemate with Senate,0
141,Stock market sell-off continues as U.S. government shutdown looms | CBC News,0
142,Kushners buying 4th New Jersey property in tax-break zone,0
143,Trump is 'throwing a temper tantrum': Chuck Schumer has some thoughts about the president's threat to shut down the government,0
144,"'A tailspin': Under siege, Trump propels the government and markets into crisis",0
145,"Senate Intel Statement on Treasury Department’s Sanctions on Oleg Deripaska, Companies",0
146,Pollster says most Americans believe economy is rigged to favor the elites,0
147,Lindsey Graham Vows to Send Mean Tweets to Trump to Let Him Know Just How Upset He Is,0
148,About half of U.S. troops in Afghanistan to be withdrawn within weeks,0
149,Megan Mullally horrified that President Trump used their Emmys sketch to hype his farm bill,0
150,Trump announces Mattis leaving in February,0
151,‘Fox & Friends’ Slams Trump on Syria Withdrawal: Only a Child Would Think ISIS Is Defeated,0
152,"Trump's sudden Syria pullout will embolden ISIS and Iran, allies warn",0
153,Trump sparks fear across party lines,0
154,I Hope That Tax Cut Was Worth It,0
155,Trump Used to Write Out His Tweets in Sharpie,0
156,Judge approves deal to close Trump Foundation,0
157,"Trump agitating for major military withdrawal from Afghanistan, advisers say",0
158,A Memo and a Recusal Decision Underscore Potential Threats to the Mueller Inquiry,0
159,Deputy Attorney General Rod J. Rosenstein Announces Charges Against Chinese Hackers | OPA,0
160,"Don Lemon Digs Up Old Clip Of Trump Talking Campaign Finance, Can't Help Laughing",0
161,‘I’m okay with a shutdown’: Inside the chaos of the House GOP’s last days,0
162,Report: Widespread fraud within prison industries agency,0
163,Michigan’s GOP-led legislature votes to increase its power ahead of Dem takeover,0
164,Analysis | Trump’s attorney general pick looks more and more like an anti-Mueller zealot,0
165,Vladimir Putin Welcomes U.S. Withdrawal From Syria,0
166,Gutierrez deals harsh criticism to Homeland Security Secretary Nielsen and Trump administration over family separations at border,0
167,"Wilmington Trust ex-president, CFO gets 6-year prison terms for lying to U.S., private investors in 2008 meltdown",0
168,"Civilians Are Cheaper Than Contractors for Most Defense Jobs, Internal Report Finds",0
169,US military ordered to withdraw about half the troops in Afghanistan,0
170,Ex-Senate aide gets 2 months in prison for lying to FBI,0
171,Trump stuffs political grenades in Washington's Christmas stocking,0
172,New Reports Shed Light on Internet Research Agency’s Social Media Tactics,0
173,"Analysis: As advisers leave, Trump’s guardrails come off",0
174,‘Not a Question’: Fmr Fed Prosecutor Says Roger Stone Likely to Be Indicted for Multiple Crimes,0
175,"Fact Check: Mexico Isn't Paying For The Border Wall, Military Unlikely To Build It",0
176,"N.C. elections board alerted prosecutors to alleged 2016 ballot harvesting, but nothing happened",0
177,‘This is akin to surrendering’: Senators slam Trump’s planned Syria withdrawal,0
178,U.S. Commission on Civil Rights now supports federal recognition of Native Hawaiians,0
179,Trump Said ISIS Has Been Defeated in Syria. That’s News to His National Security Team.,0
180,"2 U.S. Airmen Sue Pentagon, Say They Were Discharged For Being HIV-Positive",0
181,"James Mattis's Strange, Steady Tenure Is Coming to an End",0
182,White House has asked the Pentagon to draw up plans for Afghan troop withdrawal,0
183,"On an Eventful Day, Trump Tweets a Video of Himself Singing a Sitcom’s Theme Song",0
184,"Good riddance, Paul Ryan",0
185,The Lame Reason Bob Goodlatte Is Tanking A Bill That Helps Abused Native Women,0
186,Fox News host: 'We'd be up in arms' if Obama did what Trump has with funding border wall,0
187,"Stock buybacks hit a record $1.1 trillion, and the year's not over",0
188,FDA weighs legalizing interstate sales of cannabis-based CBD in food and drinks,0
189,Former Ga. candidate for governor indicted,0
190,Trump's withdrawal from Syria is victory for Iran and Russia,0
191,"US plans to withdraw 7,000 troops from Afghanistan",0
192,"After Returning from Border, Merkley and Chu Introduce Legislation to Shut Down Tornillo Child Prison",0
193,US Defence Secretary Mattis to quit,0
194,Russia Thinks Trump’s Syria Pullout Is Too Good to Be True,0
195,President Trump 'to pull thousands of troops' from Afghanistan,0
196,Trump Administration to Lift Sanctions on Putin-Linked Oligarch's Companies and the Bank Linked to Trump Tower Moscow Project Will Benefit,0
197,'Rich people won' — Cramer says Fed rate hikes widen the wealth gap by hurting working Americans,0
198,Judiciary Democrats want Whitaker to testify in 2019,0
199,Trump Caves to MAGA Allies on ‘Sacred’ Border Wall Promise,0
200,A Republican lawmaker invoked Paul Manafort's adult children in a bizarre defense of Homeland Security secretary Kirstjen Nielsen,0
201,Mattis Isn’t The Only One Worried About Allies And Rivals In Syria,0
202,‘Fox And Friends’ Host Calls Trump’s Syria Withdrawal ‘Stunning And Irresponsible’,0
203,Ethics committee expanding investigation into GOP rep over finance questions,0
204,Stable genius says it's a witch hunt: Echoing Trump's lies isn't journalism,0
205,Key Senate Democrat says Trump 'should withdraw' attorney general nomination,0
206,"Upheaval in National Security, Government and the Markets: Here’s the State of Play",0
207,"A new Trump rule could take food stamps away from 755,000 people",0
208,"Allies stunned, Russia delighted at Trump’s decision to withdraw from Syria",0
209,"Shutdown talks collapse: Trump won't sign spending bill, Paul Ryan says",0
210,Ken Starr: Trump can be indicted,0
211,Bureaucrats flagged White House on questions about Kushner. A judge says that's not normal,0
212,Donald Trump Is Now Worried the Economy is Going to Cost Him 2020 Re-Election: Report,0
213,Rush Limbaugh Rages About Spending Deal Without Wall: ‘Trump Gets Nothing’,0
214,Trump would like to stop talking about the wall now,0
215,Hemp Is Officially Going Legal Nationwide | HuffPost,0
216,Paul Ryan’s farewell address contained a blaze of nonsense about poverty,0
217,"Erdogan may help Trump and absolve MBS, but not for free",0
218,Why do Texas Republicans refuse to repeal a law that says gay sex is illegal?,0
219,Robert Mueller is closing in on Roger Stone,0
220,Trump can’t stop listening to the right. That’s why the government might shut down.,0
221,"Michigan Senate OKs bill to shift school money to roads, toxic sites",0
222,North Carolina Republicans override Democratic governor’s veto to force new voter ID law,0
223,President Trump Bets His Gut Is Better Than Nancy Pelosi's Math,0
224,"Paul Ryan’s small, sad goodbye",0
225,Trump May Have Found Yet Another Way to Kick Poor Families Off Food Stamps,0
226,Trump’s Attorney General Nominee Criticized Russia Investigation,0
227,"FEMA auctions off more than 34,000 unused meals in Puerto Rico as their expiration date nears",0
228,"Pro-Trump groups have raised $55 million from 136 wealthy donors, report finds",0
229,A Top Aide’s Exit Plan Raises Eyebrows in the White House,0
230,Michigan Senate votes to let legislature intervene in court cases,0
231,Financial disclosure reveals Wilbur Ross didn't divest from all stocks when he said he would,0
232,That Texas Judge Only Ruled Against Obamacare to Troll the Libs,0
233,The UK Only Found Out Trump Had Decided To Withdraw Troops From Syria When He Tweeted About It,0
234,Recent footage in Syria contradicts Trump,0
235,"Mueller seeks Roger Stone’s testimony to House intelligence panel, suggesting special counsel is near end of probe of Trump adviser",0
236,Trump says Defense Secretary Mattis will retire in February,0
237,Trump conservation pick decried for inexperience and conflicts of interest,0
238,"House approves $5.7 billion for Trump’s border wall, sending bill back to Senate and raising risk of partial shutdown",0
239,Democratic Rep. Johnson Grills DHS Sec. Nielsen: ‘Are ‘Illegal Aliens’ Human or Subhuman?’,0
240,"'Trump is a Traitor': Minneapolis Man Installs Political Holiday Light Display, and the Locals Love it",0
241,Sen. Graham: Mattis thinks 'the job in Syria is not yet done' despite Trump's order to withdraw troops,0
242,Trump Quietly Starts Firing Service Members Living with HIV Just Before the Holidays,0
243,U.S. Child Gun Deaths: Firearms Are Second Biggest Killer in America,0
244,USAA offers military members no-interest loans during the shutdown,0
245,Trump 2020 campaign used a shell company to pay ad buyers at the center of alleged illegal coordination scheme with NRA,0
246,"Cuomo hits back at Trump over New York investigations, border security",0
247,Trump Used to Make Melania Call His Staff So He Could Dictate Tweets Over the Phone,0
248,Trump Corruption Scandals Begin To Revolve Around His Inauguration,0
249,"Putin Backs Trump’s Decision To Pull Troops Out Of Syria, Says “Donald Is right""",0
250,Paul Ryan Laments Not Screwing Over More Poor People on His Way Out the Door,0
251,Student loan debt hits a new record of nearly $1.5 trillion: Report,0
252,Putin welcomes US pullout from Syria,0
253,House Intelligence expected to vote Thursday on sending Roger Stone transcript to Mueller,0
254,Senate unanimously approves bill making lynching a federal hate crime,0
255,The New Authoritarians Are Waging War on Women,0
256,CDC Analysis Shows Highest Number Of Gun Related Deaths In 40 Years,0
257,A plea bargain for Trump? There’s a problem.,0
258,An Epstein sex case is settled; Dershowitz denies latest allegation,0
259,Trump Will Always Find a Way to Punish the Poor,0
260,House passes spending bill with $5 billion for Trump's border wall,0
261,Donald Trump giving Americans indigestion,0
262,Democrats Need to Start Talking About National Security,0
263,Erin Burnett: Trump Giving Putin Exactly What He Wants,0
264,BuzzFeed News Has Won A Lawsuit Over Its Decision To Publish The Trump Dossier,0
265,How Russia Defeated America in Syria,0
266,"William Barr, Trump's Attorney General Pick, Criticized Mueller Probe In Memo: WSJ",0
267,The Shrinking Middle Class,0
268,Zinke’s unscientific reign over 500 million acres of public land,0
269,A GoFundMe campaign wants to raise money for a border wall. But it isn't that simple,0
270,Zinke was a rising star in Washington. Then he joined the Trump administration.,0
271,Pelosi Statement on Withdrawal of Troops from Syria,0
272,"DeVos gives quiet nod to arming teachers, despite hearing from many who disagree",0
273,Could Donald Trump be on the verge of his Watergate?,0
274,‘Can’t make this stuff up’: Senate GOP isn’t sweating shutdown,0
275,Markets drop as Fed signals it's not done raising interest rates yet,0
276,Inside the phenomenon of Gov. Jerry Brown,0
277,Tech from self-driving cars could solve border security without Trump's $5 billion wall,0
278,Trump can’t have his tariffs and the stock market too,0
279,Not even Trump supporters believe the president on Russia anymore,0
280,Putin warns the threat of nuclear war should not be underestimated,0
281,"Trump ‘at this moment’ opposes deal to avert shutdown, wants more border funding",0
282,Trump's Hollywood star vandalized again — this time with swastikas,0
283,Republicans Furious Over Trump Pulling Troops Out of Syria,0
284,Trump Is Prepared to Give Break to Companies Owned by Manafort-Connected Russian Oligarch,0
285,"Yes, Conservatives Have Captured the Supreme Court—but We Still Have Options",0
286,Colorado baker who refused to make gay couple's cake faces second LGBT bias allegation,0
287,Paul Ryan Says Trump Will Not Sign Senate-Passed Stopgap Bill,0
288,"'The Logical Conclusion of This Entire Con': Seems That American Right-Winger's GoFundMe Page, Not Mexico, Will Pay for Trump's Wall",0
289,"President Trump backtracks, says he won't sign spending bill without funding for border wall; Partial government shutdown likely",0
290,Judge Sides With BuzzFeed Over Publication of Steele Dossier,0
291,"As Tax Scam Turns One, Critics Say Law Is 'One of the Biggest Transfers of Wealth to Richest 1% in US History'",0
292,29 Senate Democrats call on OPM to restore trans employee guidance,0
293,House intelligence committee votes to turn over transcript of Roger Stone testimony to special counsel,0
294,Rosenstein says Trump AG nominee's memo had no impact on Mueller probe,0
295,"Mattis to retire in February, Trump says",0
296,Lifting Russian Sanctions Key to Trump Deal Exposed by Cohen,0
297,Trump signs $867B farm bill without food stamp program cuts,0
298,New Orleans' Vietnamese community reacts to Trump’s proposed immigrant policy change,0
299,Trump's presidency is so much worse than I thought,0
300,"A year after their tax cuts, how have corporations spent the windfall?",0
301,Literally Just A Big List Of Facebook’s 2018 Scandals,0
302,Trump admin to lift sanctions on firms owned by Russian oligarch Deripaska,0
303,"Despite Assurances From Trump, the U.S. Battle Against ISIS in Eastern Syria Is Far From Over",0
304,What the Collapse of the Trump Foundation Tells Us About Donald Trump,0
305,"Cambodians Who Fled War, U.S. Bombs and Genocide Now Face ICE Raids and Deportations Under Trump",0
306,Military ordered to withdraw about half the troops in Afghanistan,0
307,Conservative media turns on Trump for going wobbly on the wall,0
308,Why Did These Three Republican Lawmakers in Kansas Leave for the Democratic Party?,0
309,"U.S. Exit Seen as a Betrayal of the Kurds, and a Boon for ISIS",0
310,Honduran migrant gunned down shortly after U.S. deportation,0
311,The Trump Tower meeting gets another intriguing layer,0
312,The Trump administration is quietly taking apart our asylum system,0
313,Mystery Sealed Document In Cohen Case Placed In Vault In Federal Court,0
