,title,subreddit
330,Never mind Congress' pissing-and-moaning and posturing threats about funding for the wall. President Trump gave us his answer yesterday; and that is that the cost is covered and THE WALL WILL BE BUILT — BY THE UNITED STATES MILITARY!! #MAGA #MAGA2020 #BuildTheWall,1
331,Get Er Done Turtle 🐢 Mitch ... 👍🇺🇸🐸,1
332,DOJ charges two Chinese nationals with an 'extensive' hacking campaign,1
333,I called Mitch McConnell and incoming House Minority Leader Kevin McCarthy to demand funding for The Wall! Have you????,1
334,There's a disturbance in this sub. Can you feel it?,1
335,"The left only wants us to stay in Syria, a country that DIDN'T INVITE US, is because it's a non white country & we smart liberal white folks know what's best for them. Weather they like it or not those people will bend to our military eventually....the real racists want to colonize the M.E",1
336,Upgrade uninstalled. =====&gt;Graham v1. 0,1
337,A man of his word,1
338,Liberals are now funding ladders for Mexico. At some point we need to get real about Liberals being traitors.,1
339,No kicking the can down the road,1
340,Trudeau's Canada: Toronto Islamic Center to host Imam who praised killing of Jews,1
341,"Gun organization calls Gov. Kasich's gun bill veto the result of ""throwing a temper tantrum"" (The fact that only 15 states have Stand Your Ground is absurd, must be 50 of 50 by 2020)",1
342,Pelosi statement aged as well as her face,1
343,Sex Trafficker Ordered to Pay Underage Victim Half a Million Dollars,1
344,"Senator Ben Cardin(D-MD) January, 2018: ""The Trump Administration lacks the authority to keep U.S. military forces in Syria after the defeat of ISIS.""",1
345,"If this response doesn’t sum up the modern left, I don’t know what does.",1
346,"It’s that time. V E T O this piece of shit NO WALL FUNDING continuing resolution, Mr. President!! Contact the White House NOW!!",1
347,All I want for Christmas is a BBW,1
348,BULLSHIT - James Wolfe sentenced to a measly 2 months,1
349,"Treas Sec Steve Mnuchin, fearing Beijing's reaction, blocked financial sanctions on #China's hackers. He wants only ineffective remedies that will never stop the Chinese, so #Trump should get rid of him before he does too much more damage. #FireMnuchin",1
350,10 MILLION DOLLARS RAISED SO FAR!!! BUILD THE WALL!!!,1
351,Why Pay Taxes When We Can Direct Our Money To The Causes We Want?,1
352,California cops ‘frustrated’ with sanctuary laws stopping them from working with ICE over twice-deported criminal,1
353,"""The 98 Rock"" - Pedes, never, EVER, forget those boys on Wake Island. December 1941. *SMJ*FTW",1
354,"Please say a prayer for our oldest living American man and oldest living American veteran, 112 year old Mr. Richard Overton, hospitalized with pneumonia",1
355,On the Basis of Sex (Hollywood making movies about RBG before her Forever Sleep),1
356,Fuckin Liberals...,1
357,Driver kills Woman and eight injured when car crashes into crowd of commuters at German bus stop. Driver seemed deliberate. Nothing to see here. move along.,1
358,🚨BREAKING: POTUS is in CONTROL,1
359,According to CNN War is now good.,1
360,Colorado's Religious Persecution of Masterpiece Cakeshop Continues,1
361,It's looking like Cocaine Mitch is going to ask for a nuking of the filibuster for the Wall as an emergency measure. We are way past the point of schedule for budget reconciliation. Reconciliation requires a 3 week red tape period where vote-a-ramas and budget office studies have to be done.,1
362,"Twitter Suddenly Locks @WikiLeaks And Multiple WikiLeaks Staff Accounts - “These accounts are locked @wikileaks @assangedefence @wltaskforce @assangelegal and cannot be accessed,” Hrafnsson recently tweeted - “They also seem to have been shadow banned. Should we be worried in these critical times?”",1
363,Washington Melts Down Over Trump’s Syria Withdrawal,1
364,"With all the nonsense going around, don't lose sight of who the real enemy is.",1
365,"NBC News Contributor: If We Can't Indict Trump, Let's Go After His Kids",1
366,"Trump has promoted peace on the Korean peninsula, ended US involvement in Syria, and is now wants to pull troops out of Afghanistan, and for some reason the ""peace loving"" left can't stand it.",1
367,Hey Senators! Fund the Wall!,1
368,DHS to Return Illegal Aliens to Mexico in Effort to End 'Catch and Release' - Kirstjen Nielsen said her agency would immediately invoke Section 235(b)(2)(C) of the Immigration and Nationality Act - Return to Mexico to wait a hearing,1
369,Revised Spending Bill: $5.7B for No-Strings-Attached Border Wall Funding,1
370,"Trump would have never been able to end wars, withdraw troops, defeat ISIS etc. without someone else creating these conflicts and funding these terrorists etc. That person really deserves all the credit",1
371,Democrats HATE Sovereignty,1
372,Actual Democrat in the U.S. House of Representatives.,1
373,"If you don’t have a uterus and a vagina, you cannot have periods.",1
374,[Last thread was mass brigaded by Shareblue] This is what the leftist MSM/Globalists are attacking Tucker Carlson over. This is the quote they are blatantly lying to advertisers over and flat out refusing to actually state in full in any of their articles. This is WHY America opposes the left.,1
375,Mike drop.,1
376,Ted Lieu Who?,1
377,President Trump signs executive order making Christmas Eve a federal holiday,1
378,The salt is pouring in from /r/redacted. Sad!,1
379,Mark Zuckerberg To Lose 20 Billion Dollars In 2018 From The Facebook Stock He Owns,1
380,Cuckception,1
381,Redacted HATES it when you point out facts about Hillary Clinton's health. lol,1
382,Let The State Flow Through You!,1
383,"A Christmas Miracle, Santa Brings Soldier Home for His Girls",1
384,No One Can Be This Stupid. Did Someone Record Video of Erick Erickson Raping Kids Now They Control Him?,1
385,"Parts of France are now 'unliveable' due to migrants 'who want their culture to prevail', says Brazil's 'Tropical Trump' president",1
386,"Wore this to work today, got a lot of compliments. :)",1
387,"Denmark, With Eye on Muslims, Requires New Citizens to Shake Hands...",1
388,Watch The Moment Trump's $5.7 Billion Dollar Border Wall Was Approved By Congress,1
389,This banana didn’t age too well,1
390,Trump orders big troop reduction in Afghanistan. 🇺🇸 Welcome home boys! 🇺🇸,1
391,"WHO'S ""THEY""? A source close to the WH says: Look at it from his POV, they told him if he puts more troops in AFG in a year things would be better...They told him we could leave Syria after ISIS was defeated, now have 2 stay 4 Iran...They told him by 2019 he’d have a wall...how’d that turn out",1
392,"If not, maybe that parachute-ball thing at least.",1
393,"The ISP analytics don’t lie. Your average r/The_Donald poster is far more likely than be posting from St. Petersburg, Florida than St. Petersburg, Russia.",1
394,"Spot the liberal? Hint, it’s the one that looks like they hate America.",1
395,Who wore it better?,1
396,"Interesting concept. It would definitely cause a complete, permanent shut down. Maybe the only way that power could truly be shifted. Stop funding the swamp?",1
397,"White House throws government funding deal into doubt, says Trump ‘does not want to go further without border security’ | Fox News",1
398,4 hours ago it was at 6.2m now almost 9!!! Wow! Keep it up Pedes!,1
399,This picture should clear any doubts you may have about withdrawal from Afghanistan...,1
400,FYI - OBAMA FIRED GENERAL MATTIS WITHOUT EVEN A PHONE CALL [SUCK IT YOU SORE LEFTWING HYPOCRITIES HAHAHA - Mattis resigned gracefully while you fired him without even a phone call],1
401,“Some people are attempting to raise money to purchase ladders to scale the wall patriot's are raising money to build. this is to counter them by raising money to install slides to return them quicky to their country of origin safely”.,1
402,Shut It Down!,1
403,"Four score, and seven mags ago, the NJ State Police brought forth on this continent, a new infringement, conceived in Totalitarianism, and dedicated to the proposition that all men are created felons.",1
404,"""Close, but not close enough... Muahahaha.""",1
405,U mad?,1
406,"Can anyone remember what slave owners did for their slaves??They housed, fed, gave medical treatment...",1
407,"Watching the MSM panic about Trump's decision on Syria and Afghanistan, let me remind you that feminist champion Hillary's foreign policy created markets where women are sold as sex slaves in Libya.",1
408,#SCHUMERSHUTDOWN2 ... Because RESISTING and OBSTRUCTING the President is MORE IMPORTANT than funding for border security and protecting the American people. 🇺🇸,1
409,Build the wall Cocaine Mitch. You can do it Senate.,1
410,Laura Ingraham on Border Wall Fundraiser,1
411,Just another 'tolerant' liberal.,1
412,Remember to do this pede's to get the wall money this needs to pass the Senate tomorrow,1
413,President Trump. Turning Democrats into Middle East warmonger since 2017.,1
414,Oof ouchie my neck injury,1
415,Fox News is reporting that President Trump decided to leave Syria because he didn't want to go to war against Turkey! 4D CHESS! We avoided another war but FAKE NEWS is silent,1
416,Putin Knows,1
417,Massive red pill spotted out in the wild! What about 'Muh Socialism?!',1
418,My question to all the down-voters and leftwing hypocrites is this: Where were you when Obama fired Gen Mattis like a dog? Cat got your tongue huh. Now he resigns gracefully and you are so triggered. Give us all a break.,1
419,"Macron in Crisis: According to bookmakers Ladbrokes, the odds are 1/6 Mr Macron will remain in power for the whole of 2019 while the chance of him leaving before the end of next year is 4/1.",1
420,Texas City Featured In Al Gore’s ‘Inconvenient Sequel’ Lost Millions In Its Green Energy Gamble,1
421,"Beautiful young Scandinavian girls beheaded in MOROCCO, same country where the UN MIGRATION PACT was JUST SIGNED. So thankful President Trump refused to sign this Trojan horse pact that would've let in murderers and rapists into our country.",1
422,There’s no bias here.... Google is EVIL,1
423,Space Force: Ruler of Worlds.,1
424,Nigel Farage: Trump Supports Brexit Because It Will Upend 'Global Bureaucracy',1
425,I tried using this card at stores and no one would take it!!! WTF Liberals?!,1
426,The wars are gone,1
427,"Trump’s Making Health Insurance More Affordable - Obamacare apologists from Obama on down insist on keeping it unaffordable - In Tampa, Florida, a short term plan for a family of three costs $1,169 a year, less than one tenth the $12,071 sticker price of Obamacare",1
428,"10x Award winning reporter, including winner of joirnalist of the year found guilty of writing FAKE NEWS to make Trump supporters look bad. His excuse? ""I'm sick and need help'",1
429,Just so you know folks the conspiracy theory that the fed wants to crash the economy because it is doing too well is not a theory.,1
430,Jury Duty,1
431,"From Mississippi, thank you Mr. President",1
432,The cakeshop trust and safety council does not comment on individual cases of baking denials. Problem solved.,1
433,This meme goes out to the three slope browed knuckle dragging donkey humping death cultist animals who murdered the two lady hikers. And every one of the hundreds of millions of Religion Of Peace members who support them.,1
434,Bigfoot spotted in $4000 Balenciaga boots. But cares deeeeeeply about Chicago being a shithole.,1
435,"Good old Kasich makes big woofing noises about guns, while according to the DEA, Ohio-based ""Miami-Luken"" supplied 6.4 million hydrocodone and oxycodone pills to just one pharmacy In WV between 2008 and 2015. The town had a population of 3,191 people!",1
436,Democrats demand answers from HUD on whether DACA recipients are being denied FHA loans - Legal Immigrants qualify - ILLEGAL ones Do Not - DACA Recipients are Non-Permanent Residents & need a valid SSN to qualify,1
437,MFW reading this batshit redacted post,1
438,5.7 on its way. 10M in 4 days.,1
439,Two years in and Trump is doing his best despite the closeted Chuck Schumer and Nancy Pelosi doing everything to stop him. At the end of the day...he is fighting for us and liberal women are still ugly as dogs. 👌🏼,1
440,....equipment. General Mattis was a great help to me in getting allies and other countries to pay their share of military obligations. A new Secretary of Defense will be named shortly. I greatly thank Jim for his service!,1
441,"Guardian: Doxxing journalists is bad, doxxing conservatives is good.",1
442,Senate Intel Aide Sentenced To Two Months In Prison For Lying To FBI About Media Contacts,1
443,Libs' reaction to the Syria news today,1
444,"It’s time to protect OUR COUNTRY, guard OUR BORDERS, invest in OUR MILITARY to protect OUR PEOPLE on OUR SOIL! AMERICA FIRST!",1
445,Pelosi and Schumer Humiliated. GEOTUS time traveler confirmed. Next they'll obstruct and look even more petty...if it's possible at this point.,1
446,If the senate is unhappy they can always vote to declare war on syria.,1
447,"Ok, whitch one of you pedes donated $80 under Nansi Pelosi's name to the Wall Fund? Brilliant!",1
448,I love the smell of MSM jealousy in the air,1
449,Concrete is so 2017,1
450,"Wolf Pretends He cares For Workers at Christmas? Wolf Blitzer Not Only Carries Water for the DNC, He's the Hired Security For The DNC Well. These Talking Heads...",1
451,Challenge Accepted,1
452,Susan Collins learns just how vile and nasty the American Communist are. Gets red pilled after her support for Judge Kavanaugh,1
453,Based Ted.,1
454,It's Up To You Now Cryin' Chuck!,1
455,"Listen! Do you here it? ""sccccccrreeeeeeeeeeeeeeeeeee""",1
456,My son spent our entire walk today doing a great Jeff Sessions impression. He didn’t indict Hillary once the whole time!,1
457,What emails?!,1
458,CNN: White male with fully functional limb discriminates against Mexican quadriplegic community.,1
459,🇺🇸WHAT A TIME TO BE ALIVE🇺🇸,1
460,"Television networks decry Trump listening to the ""far-right"" Conservatives on border funding, describing them like animals",1
461,Historic Cash Flows Returning to the U.S. for 3rd Quarter in a Row After Tax Act,1
462,Which one of you pedes did this?,1
463,SOON,1
464,"Some say it's a feminist symbol, this is more accurate ( no disrespect ladypedes, I love and respect you all)",1
465,"Muslims in Europe Becoming Less Secular, More Radical (Who would of thunk it)",1
466,Who is going to be left behind first?,1
467,New way to resist Trump discovered. Jumping off a cliff!,1
468,Thanks Steve Scalise,1
469,"I can't stand it when I hear feminist chant ""my body, my rights"" NOPE! Its not your body dumbasses! Stop killing future citizens of the world!",1
470,"California Taxes, Overregulation Force 1,800 Businesses To Relocate",1
471,Man Accused of Using Woman's Identity to Buy $100k in Restaurant Equipment,1
472,Wesley Clark raises the prospect that Trump has taken bribes from foreign countries in his Syria decisons. No evidence. Good to have a solid citizen to turn to on CNN on a heavy news day.,1
473,This is your brain on CNN. Any questions?,1
474,Disgraceful Flynn Judge Orders Deported Migrants Flown Back into U.S. — Based on U.N. Rules,1
475,"In a brutal and completely unnecessary show of force, We the People Will Build a Wall Around Commifornia.",1
476,The evolution and change of the Russian threat,1
477,Media and Neocons Unite to Attack Trump’s Syria Decision - Fake News is the Enemy of the People!,1
478,"Now That The Russian Collusion Narrative Is Deflating, The Left Is Shifting Goalposts. It’s increasingly difficult to sustain the smoke without any actual fire, and that reality is now evident in even liberal publications.",1
479,You can go fuck yourself too.,1
480,Big Mike Vs. Sarah Jessica Parker,1
481,Typical libtard in socal 😂😂😂,1
482,We did it!,1
483,Final Smash the Dems!!!,1
484,"Centipedes, the only way to get the wall funded in the Senate is through BUDGET RECONCILIATION. Just like we Did through the Tax Cuts and Jobs act. Or Cocaine Mitch has to change the rules",1
485,And exactly what oath of office did he swear in to do? Anything about defending the US Constitution?,1
486,"December 20, 2018 a young looking genius of a MAN! God bless this President and the USA!",1
487,House passes temporary government funding bill that includes $5 billion for border wall money,1
488,MRW the rest of Reddit is freaking out over a potential veto of the spending bill,1
489,"Hey downvoters, here's how many people you're converting.",1
490,"FITTON:PROOF: We are in Syria because of Obama and Hillary--key document tied Benghazi, to Western support for AQI and rise of ISIS.",1
491,"REMINDER : Read your history books guys, don't wanna end up like this fellow here",1
492,IM SURE YOU'VE VIEWED THIS PHOTO OF THE GREATEST LEADER THIS COUNTRIES SEEN IN A LONG TIME.. BUT FOR OUR FIRST LADY TO HAVE BEEN IGNORED BY EVERY MAGAZINE COVER.. SAME MAGAZINES THAT PLASTERED MICHELLE OBAMAS MUG. MAKES ME SICK!!!!! THE MEDIA IS THE TRUE ENEMY OF THE USA. ENEMY #1,1
493,GOP Leader McCarthy: House Will Have the Votes to Pass Spending Bill WITH Border Wall Funding Tonight,1
494,LA sheriff A. Villanueva says he will Physically remove ICE agents from jail,1
495,How The FBI Ran An Illegal Counterintelligence Masquerade In Plot To Get Trump,1
496,President Trump Declares Christmas Eve as a Federal Holiday,1
497,"GoFundMe launched to pay for Trump's border wall, nears $3M in two days",1
498,"DHS Sec Nielsen says migrants entering US illegally may be returned to Mexico, applications pending",1
499,He’s a Border (Wall) Collie today,1
